{
  "format": "aub-implementation-report",
  "format_version": "1.0.0",
  "blueprint": {
    "screen_id": "workspace.react_aub_workspace_drawer",
    "version": "0.3.0"
  },
  "implementation": {
    "framework": "react",
    "route": "/editor/workspace-drawer",
    "files": [
      "apps/editor/src/components/WorkspacePanel.tsx",
      "apps/editor/src/App.css",
      "apps/editor/src/lib/workspace-client.ts"
    ]
  },
  "node_mappings": [
    {
      "node_id": "root",
      "status": "mapped",
      "component": "page",
      "file": "apps/editor/src/components/WorkspacePanel.tsx",
      "selector": "[data-aub-node=\"root\"]",
      "notes": "AUB self-dogfood sample maps the workspace drawer contract back to editor source files."
    },
    {
      "node_id": "section_section",
      "status": "mapped",
      "component": "section",
      "file": "apps/editor/src/components/WorkspacePanel.tsx",
      "selector": "section.`workspace-panel${connected.?.'.connected'.:.''",
      "notes": "AUB self-dogfood sample maps the workspace drawer contract back to editor source files."
    },
    {
      "node_id": "header_header",
      "status": "mapped",
      "component": "header",
      "file": "apps/editor/src/components/WorkspacePanel.tsx",
      "selector": "header",
      "notes": "AUB self-dogfood sample maps the workspace drawer contract back to editor source files."
    },
    {
      "node_id": "text_span",
      "status": "mapped",
      "component": "text",
      "file": "apps/editor/src/components/WorkspacePanel.tsx",
      "selector": "span",
      "notes": "AUB self-dogfood sample maps the workspace drawer contract back to editor source files."
    },
    {
      "node_id": "card_div",
      "status": "mapped",
      "component": "card",
      "file": "apps/editor/src/components/WorkspacePanel.tsx",
      "selector": "div.workspace-connect-row",
      "notes": "AUB self-dogfood sample maps the workspace drawer contract back to editor source files."
    },
    {
      "node_id": "text_input_on_endpoint_change_event_target_value_placeholder_http_127_0_0_1",
      "status": "mapped",
      "component": "text_input",
      "file": "apps/editor/src/components/WorkspacePanel.tsx",
      "selector": "input",
      "notes": "AUB self-dogfood sample maps the workspace drawer contract back to editor source files."
    },
    {
      "node_id": "button_button",
      "status": "mapped",
      "component": "button",
      "file": "apps/editor/src/components/WorkspacePanel.tsx",
      "selector": "button",
      "notes": "AUB self-dogfood sample maps the workspace drawer contract back to editor source files."
    },
    {
      "node_id": "card_refresh_ccw",
      "status": "mapped",
      "component": "card",
      "file": "apps/editor/src/components/WorkspacePanel.tsx",
      "selector": "RefreshCcw",
      "notes": "AUB self-dogfood sample maps the workspace drawer contract back to editor source files."
    },
    {
      "node_id": "card_wifi",
      "status": "mapped",
      "component": "card",
      "file": "apps/editor/src/components/WorkspacePanel.tsx",
      "selector": "Wifi",
      "notes": "AUB self-dogfood sample maps the workspace drawer contract back to editor source files."
    },
    {
      "node_id": "button_zh_disconnect",
      "status": "mapped",
      "component": "button",
      "file": "apps/editor/src/components/WorkspacePanel.tsx",
      "selector": "button",
      "notes": "AUB self-dogfood sample maps the workspace drawer contract back to editor source files."
    },
    {
      "node_id": "card_x",
      "status": "mapped",
      "component": "card",
      "file": "apps/editor/src/components/WorkspacePanel.tsx",
      "selector": "X",
      "notes": "AUB self-dogfood sample maps the workspace drawer contract back to editor source files."
    },
    {
      "node_id": "text_p",
      "status": "mapped",
      "component": "text",
      "file": "apps/editor/src/components/WorkspacePanel.tsx",
      "selector": "p.workspace-error",
      "notes": "AUB self-dogfood sample maps the workspace drawer contract back to editor source files."
    },
    {
      "node_id": "section_section_2",
      "status": "mapped",
      "component": "section",
      "file": "apps/editor/src/components/WorkspacePanel.tsx",
      "selector": "section.workspace-demo-story",
      "notes": "AUB self-dogfood sample maps the workspace drawer contract back to editor source files."
    },
    {
      "node_id": "text_p_2",
      "status": "mapped",
      "component": "text",
      "file": "apps/editor/src/components/WorkspacePanel.tsx",
      "selector": "p",
      "notes": "AUB self-dogfood sample maps the workspace drawer contract back to editor source files."
    },
    {
      "node_id": "card_div_2",
      "status": "mapped",
      "component": "card",
      "file": "apps/editor/src/components/WorkspacePanel.tsx",
      "selector": "div.workspace-demo-steps",
      "notes": "AUB self-dogfood sample maps the workspace drawer contract back to editor source files."
    },
    {
      "node_id": "text_span_2",
      "status": "mapped",
      "component": "text",
      "file": "apps/editor/src/components/WorkspacePanel.tsx",
      "selector": "span",
      "notes": "AUB self-dogfood sample maps the workspace drawer contract back to editor source files."
    },
    {
      "node_id": "text_span_3",
      "status": "mapped",
      "component": "text",
      "file": "apps/editor/src/components/WorkspacePanel.tsx",
      "selector": "span",
      "notes": "AUB self-dogfood sample maps the workspace drawer contract back to editor source files."
    },
    {
      "node_id": "text_span_4",
      "status": "mapped",
      "component": "text",
      "file": "apps/editor/src/components/WorkspacePanel.tsx",
      "selector": "span",
      "notes": "AUB self-dogfood sample maps the workspace drawer contract back to editor source files."
    },
    {
      "node_id": "card_zh_demo_safety_loop_demo_safety_loop_summary",
      "status": "mapped",
      "component": "card",
      "file": "apps/editor/src/components/WorkspacePanel.tsx",
      "selector": "div.workspace-demo-evidence",
      "notes": "AUB self-dogfood sample maps the workspace drawer contract back to editor source files."
    },
    {
      "node_id": "section_section_3",
      "status": "mapped",
      "component": "section",
      "file": "apps/editor/src/components/WorkspacePanel.tsx",
      "selector": "section.workspace-onboarding",
      "notes": "AUB self-dogfood sample maps the workspace drawer contract back to editor source files."
    },
    {
      "node_id": "heading_h3",
      "status": "mapped",
      "component": "heading",
      "file": "apps/editor/src/components/WorkspacePanel.tsx",
      "selector": "h3",
      "notes": "AUB self-dogfood sample maps the workspace drawer contract back to editor source files."
    },
    {
      "node_id": "text_p_3",
      "status": "mapped",
      "component": "text",
      "file": "apps/editor/src/components/WorkspacePanel.tsx",
      "selector": "p",
      "notes": "AUB self-dogfood sample maps the workspace drawer contract back to editor source files."
    },
    {
      "node_id": "card_workspace_wizard",
      "status": "mapped",
      "component": "card",
      "file": "apps/editor/src/components/WorkspacePanel.tsx",
      "selector": "WorkspaceWizard",
      "notes": "AUB self-dogfood sample maps the workspace drawer contract back to editor source files."
    },
    {
      "node_id": "badge_div",
      "status": "mapped",
      "component": "badge",
      "file": "apps/editor/src/components/WorkspacePanel.tsx",
      "selector": "div.workspace-status-pills",
      "notes": "AUB self-dogfood sample maps the workspace drawer contract back to editor source files."
    },
    {
      "node_id": "text_span_5",
      "status": "mapped",
      "component": "text",
      "file": "apps/editor/src/components/WorkspacePanel.tsx",
      "selector": "span",
      "notes": "AUB self-dogfood sample maps the workspace drawer contract back to editor source files."
    },
    {
      "node_id": "text_span_6",
      "status": "mapped",
      "component": "text",
      "file": "apps/editor/src/components/WorkspacePanel.tsx",
      "selector": "span",
      "notes": "AUB self-dogfood sample maps the workspace drawer contract back to editor source files."
    },
    {
      "node_id": "text_span_7",
      "status": "mapped",
      "component": "text",
      "file": "apps/editor/src/components/WorkspacePanel.tsx",
      "selector": "span",
      "notes": "AUB self-dogfood sample maps the workspace drawer contract back to editor source files."
    },
    {
      "node_id": "text_span_8",
      "status": "mapped",
      "component": "text",
      "file": "apps/editor/src/components/WorkspacePanel.tsx",
      "selector": "span",
      "notes": "AUB self-dogfood sample maps the workspace drawer contract back to editor source files."
    },
    {
      "node_id": "text_span_9",
      "status": "mapped",
      "component": "text",
      "file": "apps/editor/src/components/WorkspacePanel.tsx",
      "selector": "span",
      "notes": "AUB self-dogfood sample maps the workspace drawer contract back to editor source files."
    },
    {
      "node_id": "text_storybook",
      "status": "mapped",
      "component": "text",
      "file": "apps/editor/src/components/WorkspacePanel.tsx",
      "selector": "span",
      "notes": "AUB self-dogfood sample maps the workspace drawer contract back to editor source files."
    },
    {
      "node_id": "text_span_10",
      "status": "mapped",
      "component": "text",
      "file": "apps/editor/src/components/WorkspacePanel.tsx",
      "selector": "span",
      "notes": "AUB self-dogfood sample maps the workspace drawer contract back to editor source files."
    },
    {
      "node_id": "button_div",
      "status": "mapped",
      "component": "button",